{
  "spec": "hpl.event.v1",
  "tz": "America/Los_Angeles",
  "producer": {
    "name": "visionclaw",
    "version": "0.0.0-fixture"
  },
  "event_id": "01JA0000000000000000000003",
  "type": "meal.end",
  "occurred_at": "2026-10-11T20:05:00Z",
  "session_id": "01JA00000000000000000000S1",
  "payload": {}
}
