{
  "spec": "hpl.event.v1",
  "tz": "America/Los_Angeles",
  "producer": {
    "name": "visionclaw",
    "version": "0.0.0-fixture"
  },
  "event_id": "01JA0000000000000000000004",
  "type": "lifestyle.event",
  "occurred_at": "2026-10-11T21:30:00Z",
  "payload": {
    "kind": "caffeine",
    "amount": 1,
    "unit": "cup"
  }
}
