{
  "spec": "hpl.event.v1",
  "tz": "America/Los_Angeles",
  "producer": {
    "name": "visionclaw",
    "version": "0.0.0-fixture"
  },
  "event_id": "01JA0000000000000000000001",
  "type": "meal.start",
  "occurred_at": "2026-10-11T19:42:10Z",
  "session_id": "01JA00000000000000000000S1",
  "payload": {
    "trigger": "voice"
  }
}
